{
  "id": "b3380e4e-fa33-4667-9e1f-0c9296c8f8e4",
  "kind": "dataSource",
  "name": "ItemTotals",
  "formatVersion": 1,
  "entity": "Item",
  "fields": [
    { "name": "quantity", "path": "quantity" },
    { "name": "price", "path": "price" }
  ],
  "filter": "active == true",
  "aggregate": {
    "groupBy": [],
    "measures": [
      { "name": "items", "function": "count" },
      { "name": "quantitySum", "function": "sum", "field": "quantity" },
      { "name": "priceSum", "function": "sum", "field": "price" },
      { "name": "priceMax", "function": "max", "field": "price" }
    ]
  }
}
